"Author","gender_guessed","Title","gender_fixed","nationality1","nationality2","nationality3","nationality4","Country.Chosen","n","Source","country_chosen"
"Maxine Hong Kingston","female","The Woman Warrior","female","American","","","","American",1,"Eva",NA
"Maxine Mei-Fung Chung","female","The Eighth Girl","female","British","","","","British",1,"Viki",NA
"May-Lan Tan","unknown","Things to Make and Break","female","Hong Kong","","","","Hong Kong",1,"Viki",NA
"Maya Abu Al-Hayat","female","The Book of Ramallah: A City in Short Fiction (Reading the City)","female","Palestinian","Lebanese","","","Palestinian",1,"Viki",NA
"Maya Angelou","female","I Know Why the Caged Bird Sings (Maya Angelou's Autobiography, #1)","female","American","","","","American",4,"Adam",NA
"Maya Montayne","female","Nocturna (A Forgery of Magic #1)","female","American","","","","American",NA,"Other",NA
"Maynard Solomon","unknown","Mozart","male","American","","","","American",1,"Maryann",NA
"Mazie K. Hirono","female","Heart of Fire: An Immigrant Daughter's Story","female","American","","","","American",1,"Luisa",NA
"Meb Keflezighi","unknown","26 Marathons: What I've Learned About Faith, Identity, Running, and Life From Each Marathon I've Run","male","American","Eritrean","","","Eritrean",1,"Corinne",NA
"Meena Kandasamy","female","When I Hit You: Or, A Portrait of the Writer as a Young Wife","female","Indian","","","","Indian",1,"Viki",NA
"Meera Syal","female","The House of Hidden Mothers","female","British","","","","British",1,"Viki",NA
"Meg Cabot","female","The Princess Diaries (The Princess Diaries, #1)","female","American","","","","American",1,"Viki",NA
"Meg Howrey","female","The Wanderers","female","American","","","","American",1,"Maggie",NA
"Meg Jay","female","The Defining Decade: Why Your Twenties Matter--And How to Make the Most of Them Now","female","American","","","","American",3,"Ruby",NA
"Meg Keene","female","A Practical Wedding Planner: A Step-by-Step Guide to Creating the Wedding You Want with the Budget You've Got (without Losing Your Mind in the Process)","female","American","","","","American",1,"Stephanie",NA
"Meg Medina","female","Yaqui Delgado Wants to Kick Your Ass","female","American","","","","American",1,"Stephanie",NA
"Meg Rosoff","female","How I Live Now","female","American","","","","American",1,"Viki",NA
"Meg Wolitzer","female","The Female Persuasion","female","American","","","","American",2,"Sarah",NA
"Megan  Erickson","female","Class War: The Privatization of Childhood","female","American","","","","American",1,"Viki",NA
"Megan Miranda","female","The Last House Guest","female","American","","","","American",3,"Sarah",NA
"Megan Nolan","female","Acts of Desperation","female","Irish","","","","Irish",1,"Luisa",NA
"Megan Rapinoe","female","One Life","female","American","","","","American",1,"Sarah_McNabb",NA
"Megha Majumdar","female","A Burning","female","Indian","","","","Indian",2,"Sarah",NA
"Mei Fong","andy","One Child: The Story of China's Most Radical Experiment","female","American","","","","American",NA,"Other",NA
"Mei-Ling Hopgood","female","How Eskimos Keep Their Babies Warm: And Other Adventures in Parenting","female","American","Argentine","","","Argentine",NA,"Other",NA
"Melanie Warner","female","Pandora's Lunchbox: How Processed Food Took Over the American Meal","female","American","","","","American",1,"Tiff",NA
"Melina Marchetta","unknown","On the Jellicoe Road","female","Australian","","","","Australian",2,"Stephanie",NA
"Melinda Chateauvert","female","Sex Workers Unite: A History of the Movement from Stonewall to SlutWalk","female","American","","","","American",1,"Sarah_McNabb",NA
"Melissa Bank","unknown","The Girls' Guide to Hunting and Fishing","female","American","","","","American",1,"Stephanie",NA
"Melissa Broder","female","The Pisces","female","American","","","","American",1,"Viki",NA
"Melissa Febos","female","Girlhood","female","American","","","","American",1,"Luisa",NA
"Melissa Gira Grant","female","Playing the Whore: The Work of Sex Work","female","American","","","","American",1,"Viki",NA
"Melissa Perri","female","Escaping the Build Trap: How Effective Product Management Creates Real Value","female","American","","","","American",1,"Glen",NA
"Melody Beattie","female","Codependent No More and Beyond Codependency","female","American","","","","American",NA,"Other",NA
"Melody Wilding","female","Trust Yourself: Stop Overthinking and Channel Your Emotions for Success at Work","female","American","","","","American",1,"Alison_Shin",NA
"Meng Jin","unknown","Little Gods","female","American","Chinese","","","Chinese",1,"Viki",NA
"Menno Schilthuizen","male","Darwin Comes to Town: How the Urban Jungle Drives Evolution","male","Dutch","","","","Dutch",NA,"Other",NA
"Meredith Goldstein","female","Can't Help Myself: Lessons  Confessions from a Modern Advice Columnist","female","American","","","","American",1,"Alison_Shin",NA
"Meron Benvenisti","unknown","Sacred Landscape: The Buried History of the Holy Land  since 1948","male","Israeli","","","","Israeli",1,"Andrea",NA
"Merritt Tierce","male","Love Me Back","male","American","","","","American",1,"Viki",NA
"Mhairi McFarlane","female","Don't You Forget About Me","female","British","","","","British",1,"Viki",NA
"Mia Alvar","female","In the Country","female","Philippine","","","","Philippine",NA,"Other",NA
"Mia Birdsong","female","How We Show Up: Reclaiming Family, Friendship, and Community","female","American","","","","American",1,"Ruby",NA
"Mia Kang","female","Knockout","female","Swiss","","","","Swiss",1,"Luisa",NA
"Micaiah Johnson","unknown","The Space Between Worlds","female","American","","","","American",1,"Stephanie",NA
"Michael   Bradley","","Dead Air: A Novel of Suspense","male","American","","","","American",1,"Sarah_McNabb",NA
"Michael   Lewis","male","Liar's Poker","male","American","","","","American",12,"Cal",NA
"Michael   Russell","unknown","The City of Shadows (Stefan Gillespie, #1)","male","British","Scottish","","","Scottish",1,"Maryann",NA
"Michael  Powell","male","The Red Shoes","male","British","English","","","English",1,"Eva",NA
"Michael A. Singer","male","The Untethered Soul: The Journey Beyond Yourself","male","American","","","","American",1,"Corinne",NA
"Michael Baigent","male","Holy Blood, Holy Grail","male","New Zealand","","","","New Zealand",1,"Adam",NA
"Michael Bliss","male","William Osler: A Life in Medicine","male","Canadian","","","","Canadian",1,"Andrea",NA
"Michael Buckley","male","Undertow (Undertow, #1)","male","American","","","","American",11,"Adam",NA
"Michael Chabon","male","The Final Solution","male","American","","","","American",13,"Adam",NA
"Michael Connelly","male","Dark Sacred Night (Renée Ballard, #2; Harry Bosch, #21; Harry Bosch Universe, #31)","male","American","","","","American",29,"Liz",NA
"Michael Crichton","male","Jurassic Park (Parque Jurásico, #1)","male","American","","","","American",11,"Adam",NA
"Michael Crummey","male","The Innocents","male","Canadian","","","","Canadian",1,"Maggie",NA
"Michael Cunningham","male","The Hours","male","American","","","","American",2,"Adam",NA
"Michael D. Watkins","male","The First 90 Days: Proven Strategies for Getting Up to Speed Faster and Smarter","male","Canadian","","","","Canadian",2,"Bernadette",NA
"Michael Dibdin","unknown","Ratking (Aurelio Zen, #1)","male","British","Northern Irish","","","Northern Irish",2,"Maryann",NA
"Michael Ende","male","The Neverending Story","male","German","","","","German",2,"Adam",NA
"Michael Frayn","male","Copenhagen","male","British","English","","","English",2,"Eva",NA
"Michael G. Marmot","male","The Health Gap: The Challenge of an Unequal World","male","English","","","","English",1,"Sarah_McNabb",NA
"Michael Hastings","male","I Lost My Love in Baghdad: A Modern War Story","male","American","","","","American",1,"Andrea",NA
"Michael J. Bader","male","Arousal: The Secret Logic of Sexual Fantasies","male","American","","","","American",1,"Adam",NA
"Michael J. Sandel","male","What Money Can't Buy: The Moral Limits of Markets","male","American","","","","American",3,"Andrea",NA
"Michael Kranish","male","The World's Fastest Man: The Extraordinary Life of Cyclist Major Taylor, America's First Black Sports Hero","male","American","","","","American",1,"Luisa",NA
"Michael Meyer","male","In Manchuria: Journeys Across China's Northeast Frontier","male","American","British","Canadian","","Canadian",2,"Glen",NA
"Michael Moore","male","Stupid White Men","male","American","","","","American",2,"Adam",NA
"Michael Moss","male","Hooked: Food, Free Will, and How the Food Giants Exploit Our Addictions","male","American","","","","American",2,"Tiff",NA
"Michael Ondaatje","male","The English Patient","male","Canadian","Sri Lankan","","","Sri Lankan",10,"Andrea",NA
"Michael Patrick MacDonald","male","All Souls: A Family Story from Southie","male","American","","","","American",1,"Bev",NA
"Michael Pollan","male","Cooked: A Natural History of Transformation","male","American","","","","American",8,"Andrea",NA
"Michael Punke","male","The Revenant","male","American","","","","American",1,"Sarah_McNabb",NA
"Michael Robotham","male","The Secrets She Keeps","male","Australian","","","","Australian",1,"Viki",NA
"Michael S. Kimmel","male","The Gendered Society","male","American","","","","American",2,"Andrea",NA
"Michael Shaara","male","The Killer Angels (The Civil War Trilogy, #2)","male","American","","","","American",1,"Sarah_McNabb",NA
"Michael Shermer","male","The Believing Brain: From Spiritual Faiths to Political Convictions - How We Construct Beliefs and Reinforce Them as Truths","male","American","","","","American",1,"Viki",NA
"Michael Shnayerson","male","Boom: Mad Money, Mega Dealers, and the Rise of Contemporary Art","male","American","","","","American",NA,"Other",NA
"Michael T. Klare","unknown","The Race for What's Left: The Global Scramble for the World's Last Resources","male","American","","","","American",1,"Maryann",NA
"Michael W. Twitty","male","The Cooking Gene: A Journey Through African American Culinary History in the Old South","male","American","","","","American",NA,"Other",NA
"Michael Young","male","The Rise of the Meritocracy","male","American","","","","American",1,"Stephanie",NA
"Michel Bussi","male","Time is a Killer","male","French","","","","French",3,"Viki",NA
"Michel Déon","unknown","The Foundling Boy (The Foundling Boy #1)","male","French","","","","French",1,"Maryann",NA
"Michel Faber","male","Under the Skin","male","Dutch","","","","Dutch",3,"Adam",NA
"Michel Foucault","male","Madness and Civilization: A History of Insanity in the Age of Reason","male","French","","","","French",1,"Adam",NA
"Michele Filgate","female","What My Mother and I Don't Talk About: Fifteen Writers Break the Silence","female","American","","","","American",2,"Sarah",NA
"Michele Wallace","female","Invisibility Blues: From Pop to Theory","female","American","","","","American",2,"Viki",NA
"Michelle  Kuo","female","Reading with Patrick: A Teacher, a Student, and a Life-Changing Friendship","female","American","Taiwanese","","","Taiwanese",1,"Ruby",NA
"Michelle Adelman","female","Piece of Mind","female","American","","","","American",1,"Corinne",NA
"Michelle Alexander","female","The New Jim Crow: Mass Incarceration in the Age of Colorblindness (Revised Edition)","female","American","","","","American",1,"Luisa",NA
"Michelle McNamara","female","I'll Be Gone in the Dark: One Woman's Obsessive Search for the Golden State Killer","female","American","","","","American",3,"Ruby",NA
"Michelle Obama","female","Becoming","female","American","","","","American",14,"Sarah",NA
"Michelle Zauner","female","Crying in H Mart","female","American","","","","American",1,"Alison_Shin",NA
"Michio Kaku","male","The Future of Humanity: Terraforming Mars, Interstellar Travel, Immortality and Our Destiny Beyond Earth","male","American","","","","American",1,"Adam",NA
"Mick Kitson","male","Sal","male","British","","","","British",1,"Viki",NA
"Mieko Kawakami","female","Breasts and Eggs","female","Japanese","","","","Japanese",2,"Viki",NA
"Miguel de Cervantes Saavedra","male","Don Quixote","male","Spanish","","","","Spanish",1,"Eva",NA
"Miguel Ruiz","male","The Four Agreements: A Practical Guide to Personal Freedom","male","Mexican","","","","Mexican",3,"Corinne",NA
"Mihail Sebastian","male","Women","male","Romanian","","","","Romanian",1,"Viki",NA
"Mihaly Csikszentmihalyi","unknown","Finding Flow: The Psychology of Engagement with Everyday Life","male","American","Hungarian","","","Hungarian",2,"Adam",NA
"Mika Waltari","male","Zázračný Josef neboli Život je dobrodružství","male","Finnish","","","","Finnish",1,"Mery",NA
"Mike    Lewis","male","When to Jump: If the Job You Have Isn't the Life You Want","male","Canadian","Japanese","","","Japanese",NA,"Other",NA
"Mike  Shanahan","male","Gods, Wasps and Stranglers: The Secret History and Redemptive Future of Fig Trees","male","American","","","","American",1,"Luisa",NA
"Mike Birbiglia","male","Sleepwalk with Me: and Other Painfully True Stories","male","American","","","","American",1,"Liz",NA
"Mike Gayle","male","Half a World Away","male","British","","","","British",1,"Viki",NA
"Mike Lupica","male","Travel Team","male","American","","","","American",1,"Cal",NA
"Mike Mignola","male","Hellboy, Vol. 4: The Right Hand of Doom","male","American","","","","American",2,"Adam",NA
"Mikhail Bulgakov","male","The Master and Margarita","male","Russian","Soviet","","","Russian",2,"Andrea",NA
"Mikhail Lermontov","male","A Hero of Our Time","male","Russian","","","","Russian",1,"Eva",NA
"Mikhail Sholokhov","unknown","And Quiet Flows the Don","male","Soviet","","","","Soviet",1,"Maryann",NA
"Mikkel Aaland","male","Sweat: The Illustrated History and Description of the Finnish Sauna, Russian Bania, Islamic Hammam, Japanese Mushi-Buro, Mexican Temescal, and American Indian & Eskimo Sweatlodge","male","American","","","","American",1,"Maggie",NA
"Mikki Kendall","unknown","Hood Feminism: Notes from the Women That a Movement Forgot","female","American","","","","American",1,"Ruby",NA
"Milan Kundera","male","The Unbearable Lightness of Being","male","Czech","French","","","Czech",15,"Adam",NA
"Milo Urban","male","Živý bič","male","Slovak","","","","Slovak",1,"Mery",NA
"Milorad Pavić","male","Dictionary of the Khazars","male","Serbian","","","","Serbian",1,"Eva",NA
"Mimi Yu","female","The Girl King (The Girl King, #1)","female","American","","","","American",1,"Viki",NA
"Min Jin Lee","andy","Pachinko","female","American","South Korean","","","South Korean",10,"Cal",NA
"Mindy Kaling","female","Is Everyone Hanging Out Without Me? (And Other Concerns)","female","American","","","","American",11,"Cal",NA
"Mira Jacob","female","The Sleepwalker's Guide to Dancing","female","American","","","","American",NA,"Other",NA
"Miranda Popkey","female","Topics of Conversation","female","American","","","","American",1,"Viki",NA
"Mircea Eliade","male","The Sacred and the Profane: The Nature of Religion","male","American","Romanian","","","Romanian",1,"Eva",NA
"Miri Yū","female","Tokyo Ueno Station","female","Japanese","South Korean","","","South Korean",1,"Viki",NA
"Misha Williams","male","Sometimes I Trip On How Happy We Could Be","male","American","","","","American",NA,"Other",NA
"Mitch Albom","male","Tuesdays with Morrie","male","American","","","","American",11,"Cal",NA
"Mitchell Duneier","male","Ghetto: The Invention of a Place, the History of an Idea","male","American","","","","American",NA,"Other",NA
"Mitchell S. Jackson","male","The Residue Years","male","American","","","","American",3,"Luisa",NA
"Miyamoto Musashi","unknown","A Book of Five Rings: The Classic Guide to Strategy","male","Japanese","","","","Japanese",2,"Adam",NA
"Mo Yan","unknown","The Garlic Ballads","male","Chinese","","","","Chinese",2,"Maryann",NA
"Mohsin Hamid","male","Exit West","male","British","Pakistani","","","Pakistani",7,"Ruby",NA
"Moïra Fowley-Doyle","unknown","Spellbook of the Lost and Found","female","Irish","French","","","Irish",2,"Viki",NA
"Moira Weigel","female","Labor of Love: The Invention of Dating","female","American","","","","American",NA,"Other",NA
"Molière","unknown","Tartuffe","male","French","","","","French",4,"Elena",NA
"Molly  Smith","female","Revolting Prostitutes: The Fight for Sex Workers’ Rights","female","American","","","","American",1,"Viki",NA
"Molly Ball","female","Pelosi","female","American","","","","American",1,"Luisa",NA
"Molly Bloom","female","Molly's Game: From Hollywood's Elite to Wall Street's Billionaire Boys Club, My High-Stakes Adventure in the World of Underground Poker","female","American","","","","American",1,"Luisa",NA
"Molly Fisk","female","Using Your Turn Signal Promotes World Peace","female","American","","","","American",1,"Sarah_McNabb",NA
"Molly Guptill Manning","female","When Books Went to War: The Stories that Helped Us Win World War II","female","American","","","","American",1,"Bev",NA
"Monica Ali","female","Brick Lane","female","Bangladeshi","British","","","Bangladeshi",1,"Sarah_McNabb",NA
"Monica McInerney","female","The Alphabet Sisters","female","Australian","","","","Australian",2,"Bev",NA
"Monica Sok","female","A Nail the Evening Hangs on","female","Cambodian","American","","","Cambodian",NA,"Other",NA
"Monique Roffey","female","The Mermaid of Black Conch","female","Trinidadian and Tobagonian","British","","","Trinidadian and Tobagonian",1,"Viki",NA
"Monique W. Morris","female","Pushout: The Criminalization of Black Girls in Schools","female","American","","","","American",1,"Sarah_McNabb",NA
"Morgan  Parker","male","There Are More Beautiful Things Than Beyoncé","male","American","","","","American",1,"Viki",NA
"Morgan  Rogers","male","Honey Girl","male","British","","","","British",1,"Viki",NA
"Mosab Hassan Yousef","unknown","Son of Hamas","male","Palestinian","","","","Palestinian",1,"Andrea",NA
"Muhammad Yunus","male","Banker to the Poor: Micro-Lending and the Battle Against World Poverty","male","Bangladeshi","","","","Bangladeshi",2,"Cal",NA
"Munro Leaf","male","The Story of Ferdinand","male","American","","","","American",1,"Adam",NA
"Murasaki Shikibu","unknown","The Tale of Genji","female","Japanese","","","","Japanese",1,"Eva",NA
"Muriel Barbery","female","The Elegance of the Hedgehog","female","French","","","","French",3,"Adam",NA
"Muriel Spark","female","The Prime of Miss Jean Brodie / The Girls of Slender Means / The Driver's Seat / The Only Problem","female","British","Scottish","","","Scottish",1,"Eva",NA
"N.J. Enfield","unknown","How We Talk: The Inner Workings of Conversation","male","Australian","","","","Australian",1,"Cal",NA
"N.K. Jemisin","unknown","The Stone Sky (The Broken Earth, #3)","female","American","","","","American",18,"Andrea",NA
"Nadia Bolz-Weber","female","Pastrix: The Cranky, Beautiful Faith of a Sinner  Saint","female","American","","","","American",1,"Charlotte",NA
"Nadia Hashimi","female","When the Moon is Low","female","American","","","","American",1,"Viki",NA
"Nadia Owusu","female","Aftershocks","female","American","Tanzanian","","","Tanzanian",NA,"Other",NA
"Nafissa Thompson-Spires","female","Heads of the Colored People","female","American","","","","American",2,"Ruby",NA
"Nagesh Kumar","unknown","Foreign Direct Investment and the WTO: Policies for Growth and Industrialization","male","Indian","","","","Indian",NA,"Other",NA
"Naguib Mahfouz","unknown","The Journey of Ibn Fattouma","male","Egyptian","","","","Egyptian",1,"Eva",NA
"Nalo Hopkinson","unknown","Midnight Robber","female","Jamaican","","","","Jamaican",1,"Viki",NA
"Nam Le","male","The Boat","male","Australian","","","","Australian",2,"Marian",NA
"Namwali Serpell","unknown","The Old Drift","female","Zambian","","","","Zambian",NA,"Other",NA
"Nana Kwame Adjei-Brenyah","female","Friday Black","female","American","","","","American",3,"Ruby",NA
"Nancy Farmer","female","The House of the Scorpion (Matteo Alacran, #1)","female","American","","","","American",2,"Ruby",NA
"Nancy Kelly Allen","female","Once Upon a Dime: A Math Adventure","female","American","","","","American",1,"Adam",NA
"Nancy Mitford","female","The Pursuit of Love","female","English","","","","English",NA,"Other",NA
"Nancy Moser","female","Mozart's Sister (Ladies of History, #1)","female","American","","","","American",1,"Marian",NA
"Nancy Sporborg","female","It's Not about the Hike","female","American","","","","American",1,"Bev",NA
"Nancy Star","female","Sisters One, Two, Three","female","American","","","","American",1,"Marian",NA
"Naoki Higashida","male","The Reason I Jump: The Inner Voice of a Thirteen-Year-Old Boy with Autism","male","Japanese","","","","Japanese",2,"Viki",NA
"Naoki Matayoshi","male","Spark","male","Japanese","","","","Japanese",1,"Viki",NA
"Naoki Urasawa","male","20th Century Boys, 19 (20th Century Boys, #19)","male","Japanese","","","","Japanese",29,"Elena",NA
"Naomi Alderman","female","The Power","female","British","","","","British",6,"Andrea",NA
"Naomi Ishiguro","female","Common Ground","female","British","","","","British",2,"Viki",NA
"Naomi Klein","female","This Changes Everything: Capitalism vs. The Climate","female","Canadian","","","","Canadian",3,"Cal",NA
"Naomi Novik","female","The Last Graduate (The Scholomance, #2)","female","American","","","","American",8,"Liz",NA
"Naomi R. Tickle","female","You Can Read a Face Like a Book: How Reading Faces Helps You Succeed in Business and Relationships","female","American","","","","American",1,"Adam",NA
"Naomi Wolf","female","The Beauty Myth","female","American","","","","American",NA,"Other",NA
"Nassim Nicholas Taleb","male","The Black Swan: The Impact of the Highly Improbable","male","American","British","Lebanese","","Lebanese",1,"Sarah_McNabb",NA
"Natalie Babbitt","female","Tuck Everlasting","female","American","","","","American",1,"Maggie",NA
"Natalie Baszile","female","Queen Sugar","female","American","","","","American",1,"Liz",NA
"Natalie Eve Garrett","female","Eat Joy: Stories & Comfort Food from 31 Celebrated Writers","female","American","","","","American",1,"Viki",NA
"Natalie Goldberg","female","Writing Down the Bones + Wild Mind","female","American","","","","American",1,"Adam",NA
"Natalie Haynes","female","A Thousand Ships","female","British","","","","British",1,"Maryann",NA
"Natalie Ironside","female","The Last Girl Scout","female","American","","","","American",1,"Tiff",NA
"Natasha Diaz","female","Color Me In","female","American","","","","American",1,"Luisa",NA
"Natasha Ngan","female","Girls of Paper and Fire (Girls of Paper and Fire #1)","female","English","Malaysian","","","Malaysian",1,"Viki",NA
"Nate Fitch","female","Climbing: From Gym to Rock","female","American","","","","American",2,"Luisa",NA
"Nate Marshall","female","Finna","male","American","","","","American",NA,"Other",NA
"Nate Silver","female","The Signal and the Noise: Why So Many Predictions Fail-but Some Don't","female","American","","","","American",3,"Liz",NA
"Nathalie Abi-Ezzi","female","A Girl Made of Dust","female","Lebanese","","","","Lebanese",NA,"Other",NA
"Nathan  Hill","male","The Nix","male","American","","","","American",1,"Sarah_McNabb",NA
"Nathan Englander","male","What We Talk About When We Talk About Anne Frank","male","American","","","","American",1,"Viki",NA
"Nathan Yau","male","Visualize This: The FlowingData Guide to Design, Visualization, and Statistics","male","American","","","","American",1,"Cal",NA
"Nathanael West","unknown","Miss Lonelyhearts / The Day of the Locust","male","American","","","","American",2,"Andrea",NA
"Nathaniel Hawthorne","male","The Scarlet Letter","male","American","","","","American",7,"Andrea",NA
"Nathaniel Mackey","male","Splay Anthem","male","American","","","","American",NA,"Other",NA
"Nathaniel Philbrick","male","In the Heart of the Sea: The Tragedy of the Whaleship Essex","male","American","","","","American",3,"Maggie",NA
"Natsuko Imamura","female","The Woman in the Purple Skirt","female","Japanese","","","","Japanese",1,"Viki",NA
"Natsuo Kirino","andy","Out","female","Japanese","","","","Japanese",1,"Eva",NA
"Nawaaz Ahmed","male","Radiant Fugitives","male","American","Indian","","","Indian",NA,"Other",NA
"Nayomi Munaweera","unknown","Island of a Thousand Mirrors","female","American","","","","American",1,"Viki",NA
"Neal Bascomb","unknown","The Escape Artists: A Band of Daredevil Pilots and the Greatest Prison Break of the Great War","male","American","","","","American",1,"Maryann",NA
"Neal Pollack","male","Stretch: The Unlikely Making of a Yoga Dude","male","American","","","","American",1,"Maggie",NA
"Neal Shusterman","male","Challenger Deep","male","American","","","","American",1,"Cal",NA
"Neal Stephenson","male","Snow Crash","male","American","","","","American",7,"Andrea",NA
"Neale Donald Walsch","male","Conversations With God: An Uncommon Dialogue, Book 3","male","American","","","","American",3,"Adam",NA
"Ned Palmer","male","A Cheesemonger's History of The British Isles","male","British","","","","British",1,"Viki",NA
"Neil Gaiman","unknown","Brief Lives (The Sandman, #7)","male","British","English","","","English",31,"Glen",NA
"Neil Postman","male","Amusing Ourselves to Death: Public Discourse in the Age of Show Business","male","American","","","","American",4,"Adam",NA
"Neil Shubin","male","Your Inner Fish: a Journey into the 3.5-Billion-Year History of the Human Body","male","American","","","","American",1,"Eva",NA
"Neil Strauss","male","The Game: Penetrating the Secret Society of Pickup Artists","male","American","Kittitian","","","Kittitian",3,"Andrea",NA
"Neill Lochery","unknown","Lisbon: War in the Shadows of the City of Light, 1939-1945","male","Scottish","","","","Scottish",1,"Maryann",NA
"Nelson DeMille","male","The Cuban Affair","male","American","","","","American",4,"Liz",NA
