"Author","gender_guessed","Title","gender_fixed","nationality1","nationality2","nationality3","nationality4","Country.Chosen","n","Source","country_chosen"
"Harper Lee","male","To Kill a Mockingbird","female","American","","","","American",17,"Cal",NA
"Harriet A. Washington","female","Medical Apartheid: The Dark History of Medical Experimentation on Black Americans from Colonial Times to the Present","female","American","","","","American",1,"Sarah_McNabb",NA
"Harriet Beecher Stowe","female","Uncle Tom's Cabin","female","American","","","","American",1,"Eva",NA
"Harriet Reuter Hapgood","female","The Square Root of Summer","female","British","","","","British",1,"Viki",NA
"Harriet Tyce","female","Blood Orange","female","Scottish","","","","Scottish",1,"Viki",NA
"Harry Beckwith","male","Selling the Invisible: A Field Guide to Modern Marketing","male","American","","","","American",1,"Sarah_McNabb",NA
"Harry Brandt","unknown","The Whites","male","American","","","","American",1,"Maryann",NA
"Harry Hansen","male","The Pocket Book of O. Henry Stories","male","American","","","","American",1,"Andrea",NA
"Harry Mulisch","male","The Assault","male","Dutch","","","","Dutch",3,"Eva",NA
"Harry Patch","unknown","The Last Fighting Tommy: The Life of Harry Patch, the Oldest Surviving Veteran of the Trenches","male","British","","","","British",1,"Maryann",NA
"Haruki Murakami","","Wind/Pinball: Two Novels","male","Japanese","","","","Japanese",38,"Andrea",NA
"Harvey Pekar","male","Our Cancer Year","male","American","","","","American",1,"Andrea",NA
"Hayden Herrera","male","Frida: A Biography of Frida Kahlo","male","American","","","","American",1,"Luisa",NA
"Haywood Smith","male","Wedding Belles","male","American","","","","American",1,"Bev",NA
"Hazel Gaynor","female","The Lighthouse Keeper's Daughter","female","British","","","","British",1,"Bev",NA
"Heather   Morris","female","The Tattooist of Auschwitz (The Tattooist of Auschwitz, #1)","female","American","","","","American",3,"Liz",NA
"Heather  McGhee","female","The Sum of Us: What Racism Costs Everyone and How We Can Prosper Together","female","American","","","","American",1,"Andrea",NA
"Heather Arndt Anderson","female","Chillies: A Global History","female","American","","","","American",1,"Luisa",NA
"Heather Harpham","female","Happiness: The Crooked Little Road to Semi-Ever After","female","American","","","","American",NA,"Other",NA
"Hector Garcia Puigcerver","male","Ikigai: The Japanese Secret to a Long and Happy Life","male","Spanish","","","","Spanish",1,"Glen",NA
"Héctor Tobar","unknown","Deep Down Dark: The Untold Stories of 33 Men Buried in a Chilean Mine, and the Miracle That Set Them Free","male","American","","","","American",1,"Maryann",NA
"Heidi Julavits","female","The Folded Clock: A Diary","female","American","","","","American",1,"Bev",NA
"Heidi Murkoff","female","What to Expect When You're Expecting","female","American","","","","American",1,"Stephanie",NA
"Heinrich B√∂ll","male","The Silent Angel","male","German","","","","German",1,"Eva",NA
"Heinrich Böll","unknown","The Clown","male","German","","","","German",1,"Maryann",NA
"Heinrich Kley","male","The Drawings of Heinrich Kley","male","German","","","","German",1,"Adam",NA
"Helen          Phillips","female","The Need","female","American","","","","American",1,"Viki",NA
"Helen Callaghan","female","Dear Amy","female","Canadian","","","","Canadian",1,"Viki",NA
"Helen Castor","female","Joan of Arc: A History","female","British","","","","British",NA,"Other",NA
"Helen DeWitt","female","The Last Samurai","female","American","","","","American",NA,"Other",NA
"Helen Fielding","female","Bridget Jones's Diary","female","British","","","","British",3,"Andrea",NA
"Helen Hoang","female","The Kiss Quotient (The Kiss Quotient, #1)","female","American","","","","American",2,"Andrea",NA
"Helen Macdonald","female","H is for Hawk","female","British","","","","British",4,"Adam",NA
"Helen Oyeyemi","female","What is Not Yours is Not Yours","female","British","Nigerian","","","Nigerian",1,"Viki",NA
"Helen Prejean","female","Dead Man Walking: The Eyewitness Account of the Death Penalty That Sparked a National Debate","female","American","","","","American",1,"Liz",NA
"Helen Simonson","female","The Summer Before the War","female","British","English","","","English",4,"Bev",NA
"Helen Zia","female","Asian American Dreams: The Emergence of an American People","female","American","","","","American",NA,"Other",NA
"Helena Maleno Garzón","female","Mujer de frontera: Defender derechos no es un delito","female","Spanish","","","","Spanish",1,"Luisa",NA
"Helene Hanff","unknown","84, Charing Cross Road","female","American","","","","American",1,"Maryann",NA
"Helene Wecker","female","The Golem and the Jinni (The Golem and the Jinni, #1)","female","American","","","","American",3,"Adam",NA
"Hena Khan","unknown","Amina's Voice","female","American","","","","American",1,"Stephanie",NA
"Hendrik Falkenberg","male","Time Heals No Wounds (Baltic Sea Crime #1)","male","German","","","","German",1,"Marian",NA
"Henning Mankell","male","Before the Frost (Linda Wallander #1)","male","Swedish","","","","Swedish",13,"Sarah_McNabb",NA
"Henrik Ibsen","male","Three Plays: Hedda Gabler / A Doll's House / The Wild Duck","male","Norwegian","","","","Norwegian",2,"Andrea",NA
"Henry David Thoreau","male","Walden & Civil Disobedience","male","American","French","","","French",4,"Adam",NA
"Henry Eliot","male","Follow This Thread: A Maze Book to Get Lost In","male","American","","","","American",1,"Adam",NA
"Henry James","male","The Ambassadors","male","American","British","","","British",5,"Andrea",NA
"Henry Marsh","male","Do No Harm: Stories of Life, Death and Brain Surgery","male","British","","","","British",1,"Sarah_McNabb",NA
"Herbert Fingarette","male","Confucius: The Secular as Sacred","male","American","","","","American",1,"Eva",NA
"Herbjørg Wassmo","unknown","Dina's Book","female","Norwegian","","","","Norwegian",1,"Andrea",NA
"Herman Koch","unknown","The Dinner","male","Dutch","","","","Dutch",1,"Maryann",NA
"Herman Melville","male","Bartleby, the Scrivener ","male","American","","","","American",3,"Adam",NA
"Herman Pontzer","male","Burn: New Science Reveals How Metabolism Shapes Your Body, Health, and Longevity","male","American","","","","American",NA,"Other",NA
"Hermann Hesse","male","Siddhartha","male","German","Swiss","","","Swiss",9,"Adam",NA
"Hermione Hoby","unknown","Neon in Daylight","female","British","","","","British",1,"Viki",NA
"Hernan Diaz","unknown","In the Distance","male","Argentine","","","","Argentine",NA,"Other",NA
"Hervé Le Tellier","unknown","Electrico W","male","French","","","","French",1,"Maryann",NA
"Hibaq Osman","unknown","A Silence You Can Carry","female","Somali","","","","Somali",1,"Viki",NA
"Hideo Yokoyama","male","Six Four","male","Japanese","","","","Japanese",2,"Viki",NA
"Hilary Mantel","female","Wolf Hall (Thomas Cromwell, #1)","female","British","","","","British",9,"Andrea",NA
"Hilda D. Spear","female","Wuthering Heights by Emily Brontë","female","Scottish","","","","Scottish",1,"Mery",NA
"Hillary Jordan","female","Mudbound","female","American","","","","American",1,"Andrea",NA
"Hillary Manton Lodge","female","Jane of Austin: A Novel of Sweet Tea and Sensibility","female","American","","","","American",1,"Bev",NA
"Hillary Rodham Clinton","female","State of Terror","female","American","","","","American",4,"Luisa",NA
"Hiro Mashima","female","Fairy Tail, Vol. 01 (Fairy Tail, #1)","female","Japanese","","","","Japanese",1,"Elena",NA
"Hiroki Endo","unknown","Eden: It's an Endless World, Volume 1 (Eden: It's an Endless World, #1)","male","Japanese","","","","Japanese",1,"Elena",NA
"Hiromi Kawakami","unknown","The Ten Loves of Mr. Nishino","female","Japanese","","","","Japanese",3,"Viki",NA
"Hiromu Arakawa","","Fullmetal Alchemist, Vol. 21 (Fullmetal Alchemist, #21)","female","Japanese","","","","Japanese",4,"Elena",NA
"Hiroshi Mikitani","male","The Power to Compete: An Economist and an Entrepreneur on Revitalizing Japan in the Global Economy","male","Japanese","","","","Japanese",NA,"Other",NA
"Hiroya Oku","unknown","Gantz/3","male","Japanese","","","","Japanese",2,"Elena",NA
"Hiroyuki Takei","male","Shaman King, Vol. 1: A Shaman in Tokyo","male","Japanese","","","","Japanese",1,"Elena",NA
"Hisham Matar","male","The Return: Fathers, Sons and the Land in Between","male","American","Libyan","","","Libyan",3,"Ruby",NA
"Hitoshi Iwaaki","male","Parasyte, Volume 1","male","Japanese","","","","Japanese",1,"Elena",NA
"Ho Sok Fong","male","Lake Like a Mirror","female","Malaysian","","","","Malaysian",1,"Viki",NA
"Holly Black","female","The Cruel Prince (The Folk of the Air, #1)","female","American","","","","American",1,"Viki",NA
"Holly Wren Spaulding","female","Familiars","female","American","","","","American",NA,"Other",NA
"Homer","male","The Odyssey","male","Greek","","","","Greek",3,"Andrea",NA
"Honoré de Balzac","male","Père Goriot","male","French","","","","French",1,"Elena",NA
"Hope Jahren","female","Lab Girl","female","American","","","","American",3,"Ruby",NA
"Hope Solo","female","Solo: A Memoir of Hope","female","American","","","","American",1,"Luisa",NA
"Horace McCoy","male","They Shoot Horses, Don't They?","male","American","","","","American",1,"Viki",NA
"Horace P. Beck","male","Folklore and the Sea","male","American","","","","American",1,"Adam",NA
"Horace Walpole","male","The Castle of Otranto","male","British","","","","British",1,"Adam",NA
"Howard  Marks","male","The Most Important Thing: Uncommon Sense for the Thoughtful Investor","male","American","","","","American",NA,"Other",NA
"Howard Frank Mosher","male","On Kingdom Mountain","male","American","","","","American",1,"Bev",NA
"Howard Pyle","male","The Adventures of Robin Hood","male","American","","","","American",2,"Adam",NA
"Howard Rheingold","male","Tools for Thought: The History and Future of Mind-Expanding Technology","male","American","","","","American",1,"Alison_Shin",NA
"Howard W. French","male","China's Second Continent: How a Million Migrants Are Building a New Empire in Africa","male","American","","","","American",NA,"Other",NA
"Howard Zinn","male","A People's History of the United States","male","American","","","","American",2,"Adam",NA
"Hualing Nieh","unknown","Mulberry and Peach: Two Women of China","female","Chinese","","","","Chinese",NA,"Other",NA
"Hugh Howey","male","Dust (Silo, #3)","male","American","","","","American",NA,"Other",NA
"Humble the Poet","unknown","Unlearn: 101 Simple Truths for a Better Life","male","Canadian","","","","Canadian",1,"Corinne",NA
"Humza Arshad","unknown","Little Badman and the Invasion of the Killer Aunties","male","British","","","","British",1,"Viki",NA
"Hunter Biden","male","Beautiful Things: A Memoir","male","American","","","","American",1,"Luisa",NA
"Hunter S. Thompson","male","Fear and Loathing in Las Vegas","male","American","","","","American",2,"Elena",NA
"Hyeonseo Lee","unknown","The Girl with Seven Names: A North Korean Defectorâs Story","female","North Korean","South Korean","","","North Korean",1,"Viki",NA
"Iain M. Banks","male","Use of Weapons (Culture, #3)","male","British","Scottish","","","Scottish",5,"Adam",NA
"Iain Pears","male","An Instance of the Fingerpost","male","British","","","","British",3,"Adam",NA
"Iain Sinclair","male","London Overground: A Day's Walk Around the Ginger Line","male","British","","","","British",1,"Viki",NA
"Ian      Williams","male","The Lady Doctor (The Bad Doctor, #2)","male","American","","","","American",2,"Andrea",NA
"Ian Fleming","male","From Russia With Love (James Bond, #5)","male","British","","","","British",2,"Adam",NA
"Ian McDonald","male","New Moon (Luna #1)","male","British","","","","British",1,"Viki",NA
"Ian McEwan","male","Saturday","male","British","","","","British",12,"Andrea",NA
"Ian McGuire","male","The North Water","male","English","","","","English",3,"Ruby",NA
"Ian Rankin","unknown","Black and Blue (Inspector Rebus, #8)","male","British","Scottish","","","Scottish",1,"Maryann",NA
"Ibi Zoboi","unknown","Pride","female","American","","","","American",1,"Luisa",NA
"Ibram X. Kendi","unknown","How to Be an Antiracist","male","American","","","","American",1,"Luisa",NA
"Ignazio Silone","male","Fontamara","male","Italian","","","","Italian",1,"Elena",NA
"Ijeoma Oluo","unknown","So You Want to Talk About Race","female","American","","","","American",1,"Sarah_McNabb",NA
"Ilaria Tuti","female","Flowers Over the Inferno (Teresa Battaglia #1)","female","Italian","","","","Italian",1,"Viki",NA
"Ilya Kaminsky","male","Dancing in Odessa","male","American","Ukrainian","","","Ukrainian",2,"Viki",NA
"Imbolo Mbue","unknown","Behold the Dreamers","female","American","Cameroonian","","","Cameroonian",4,"Sarah",NA
"Immaculée Ilibagiza","unknown","Left To Tell: Discovering God Amidst the Rwandan Holocaust","female","American","Rwandan","","","Rwandan",1,"Bernadette",NA
"Imogen  Clark","female","Where the Story Starts","female","British","","","","British",1,"Maggie",NA
"Imogen Hermes Gowar","female","The Mermaid and Mrs. Hancock","female","English","","","","English",1,"Stephanie",NA
"Ingrid Persaud","female","Love After Love","female","Trinidadian and Tobagonian","British","","","Trinidadian and Tobagonian",1,"Viki",NA
"Ingrid Rojas Contreras","female","Fruit of the Drunken Tree","female","Colombian","","","","Colombian",2,"Ruby",NA
"Ir√®ne N√©mirovsky","female","Suite Fran√ßaise","female","Ukrainian","French","","","Ukrainian",1,"Eva",NA
"Ira Byock","female","The Four Things That Matter Most: A Book About Living","female","American","","","","American",NA,"Other",NA
"Irène Némirovsky","female","Suite Française","female","French","Ukrainian","","","Ukrainian",2,"Elena",NA
"Irenosen Okojie","unknown","Speak Gigantular","female","British","","","","British",2,"Viki",NA
"Irin Carmon","unknown","Notorious RBG: The Life and Times of Ruth Bader Ginsburg","female","American","","","","American",4,"Ruby",NA
"Irum Zahra","unknown","Psychaotic: See The World In Red And Black","female","Pakistani","","","","Pakistani",1,"Viki",NA
"Irvine Welsh","male","Trainspotting","male","Scottish","","","","Scottish",1,"Viki",NA
"Irving Stone","male","The Agony and the Ecstasy","male","American","","","","American",2,"Adam",NA
"Irwin W. Sherman","male","Twelve Diseases that Changed Our World: Diseases that Changed Our World and the Lessons They Teach (ASM Books Book 60)","male","American","","","","American",1,"Eva",NA
"Isaac Asimov","male","Foundation (Foundation, #1)","male","American","","","","American",17,"Glen",NA
"Isabel Allende","female","Maya's Notebook","female","American","Chilean","","","Chilean",9,"Andrea",NA
"Isabel Ashdown","female","Beautiful Liars","female","British","","","","British",2,"Viki",NA
"Isabel Wilkerson","female","Caste: The Origins of Our Discontents","female","American","","","","American",7,"Ruby",NA
"Isaiah Berlin","male","The Roots of Romanticism","male","British","Russian","","","Russian",1,"Adam",NA
"Ishmael Beah","unknown","A Long Way Gone","male","American","Sierra Leonean","","","Sierra Leonean",3,"Liz",NA
"Issa Rae","male","The Misadventures of Awkward Black Girl","male","American","","","","American",2,"Bernadette",NA
"Istvan Banyai","unknown","Zoom","male","Hungarian","","","","Hungarian",1,"Adam",NA
"Italo Calvino","unknown","I nostri antenati: Il visconte dimezzato - Il barone rampante - Il cavaliere inesistente","male","Cuban","Italian","","","Cuban",37,"Adam",NA
"Italo Svevo","male","Zeno's Conscience","male","Italian","","","","Italian",1,"Elena",NA
"Ivan Goncharov","male","Oblomov","male","Russian","","","","Russian",1,"Marian",NA
"Ivan Turgenev","male","Fathers and Sons","male","Russian","","","","Russian",3,"Andrea",NA
"Ivo Andriƒá","male","The Bridge on the Drina (Bosnian Trilogy, #1)","male","Bosnian","","","","Bosnian",1,"Eva",NA
"J.  Elle","unknown","Wings of Ebony (Wings of Ebony, #1)","female","American","","","","American",1,"Liz",NA
"J. Aelwyn Roberts","unknown","Holy Ghostbuster: A Parson's Encounters with the Paranormal","male","British","","","","British",1,"Adam",NA
"J. Anthony Lukas","unknown","Common Ground: A Turbulent Decade in the Lives of Three American Families","male","American","","","","American",1,"Alison_Shin",NA
"J. Dykstra Eusden","unknown","The Geology of New Hampshire's White Mountains","male","American","","","","American",1,"Maggie",NA
"J.D. Salinger","unknown","The Catcher in the Rye","male","American","","","","American",15,"Cal",NA
"J.D. Vance","unknown","Hillbilly Elegy: A Memoir of a Family and Culture in Crisis","male","American","","","","American",12,"Cal",NA
"J.K. Rowling","unknown","Harry Potter and the Sorcerer's Stone (Harry Potter #1)","female","British","","","","British",94,"Cal",NA
"J.L. Carr","unknown","A Month in the Country","male","British","","","","British",1,"Eva",NA
"J.M.  Holmes","unknown","How Are You Going to Save Yourself","male","American","","","","American",1,"Viki",NA
"J.M. Barrie","unknown","Peter Pan","male","British","Scottish","","","Scottish",3,"Adam",NA
"J.M. Coetzee","unknown","Disgrace","male","Australian","South African","","","South African",NA,"Other",NA
"J.R.R. Tolkien","unknown","The Hobbit, or There and Back Again","male","British","","","","British",39,"Andrea",NA
"Jack D. Zipes","male","      Arabian Nights: The Marvels and Wonders of The Thousand and One Nights, Volume 1 of 2","male","American","","","","American",1,"Eva",NA
"Jack Goldsmith","male","In Hoffa's Shadow: A Stepfather, a Disappearance in Detroit, and My Search for the Truth","male","American","","","","American",1,"Andrea",NA
"Jack Kerouac","male","On the Road","male","American","","","","American",5,"Ruby",NA
"Jack London","male","White Fang","male","American","","","","American",9,"Andrea",NA
"Jack Weatherford","male","Genghis Khan and the Making of the Modern World","male","American","","","","American",1,"Cal",NA
"Jackson Ford","male","Random Sh*t Flying Through the Air (The Frost Files #2)","male","Australian","","","","Australian",1,"Viki",NA
"Jaclyn Friedman","female","What You Really Really Want: The Smart Girl's Shame-Free Guide to Sex and Safety","female","American","","","","American",1,"Alison_Shin",NA
"Jaclyn Moriarty","female","A Corner of White","female","Australian","","","","Australian",1,"Stephanie",NA
"Jacob Burckhardt","unknown","The Civilization of the Renaissance in Italy","male","Swiss","","","","Swiss",1,"Maryann",NA
"Jacqueline Winspear","female","This Time Next Year We'll Be Laughing","female","American","British","","","British",4,"Maryann",NA
"Jacqueline Woodson","female","Red at the Bone","female","American","","","","American",2,"Stephanie",NA
"Jacquelyn Mitchard","female","The Deep End of the Ocean (Cappadora Family, #1)","female","American","","","","American",1,"Sarah_McNabb",NA
"Jacquelyn Stolos","female","Edendale","female","American","","","","American",1,"Sarah_McNabb",NA
"Jacques Prévert","male","Paroles","male","French","","","","French",1,"Elena",NA
"Jade Chang","unknown","The Wangs vs. the World","female","Taiwanese","","","","Taiwanese",2,"Viki",NA
"Jade Teta","female","      The Metabolic Effect Diet: Eat More, Work Out Less, and Actually Lose Weight While You Rest","male","American","","","","American",1,"Stephanie",NA
"Jaimal Yogis","unknown","The Fear Project: What Our Most Primal Emotion Taught Me About Survival, Success, Surfing . . . and Love","male","American","","","","American",1,"Maggie",NA
"Jaime Lowe","male","Mental: Lithium, Love, and Losing My Mind","female","American","","","","American",1,"Luisa",NA
"Jaime Schultz","male","Qualifying Times: Points of Change in U.S. Women's Sport","female","American","","","","American",1,"Sarah_McNabb",NA
"Jake Knapp","male","Sprint: How to Solve Big Problems and Test New Ideas in Just Five Days","male","American","","","","American",1,"Glen",NA
"James     Bailey","male","The Flip Side","male","American","","","","American",1,"Bev",NA
"James     Martin","male","The Jesuit Guide to (Almost) Everything: A Spirituality for Real Life","male","British","","","","British",1,"Liz",NA
"James   McBride","male","Five-Carat Soul","male","American","","","","American",5,"Ruby",NA
"James  Bradley","male","The Resurrectionist","male","American","","","","American",1,"Viki",NA
"James  Wood","male","How Fiction Works","male","American","","","","American",1,"Adam",NA
"James A. Cobb Jr.","unknown","Flood of Lies: The St. Rita's Nursing Home Tragedy","male","American","","","","American",1,"Maryann",NA
"James A. Michener","male","Tales of South Pacific","male","American","","","","American",2,"Liz",NA
"James B. Stewart","male","Heart of a Soldier","male","American","","","","American",1,"Bev",NA
"James Baldwin","male","The Fire Next Time","male","American","","","","American",12,"Cal",NA
"James Barrat","male","Our Final Invention: Artificial Intelligence and the End of the Human Era","male","American","","","","American",NA,"Other",NA
"James Bridle","male","New Dark Age: Technology and the End of the Future","male","British","","","","British",1,"Tiff",NA
"James C. Collins","male","Good to Great: Why Some Companies Make the Leap... and Others Don't","male","American","","","","American",2,"Cal",NA
"James Clavell","male","Sh≈çgun","male","American","Australian","British","","Australian",8,"Marian",NA
"James Clear","male","Atomic Habits: An Easy & Proven Way to Build Good Habits & Break Bad Ones","male","American","","","","American",4,"Glen",NA
"James Comey","female","A Higher Loyalty: Truth, Lies, and Leadership","female","American","","","","American",2,"Marian",NA
"James D. Shipman","male","It Is Well","male","American","","","","American",1,"Marian",NA
"James Dashner","male","The Maze Runner (The Maze Runner, #1)","male","American","","","","American",2,"Elena",NA
"James Ellroy","unknown","The Big Nowhere (L.A. Quartet, #2)","male","American","","","","American",1,"Maryann",NA
"James Fenimore Cooper","male","The Pathfinder (Leatherstocking Tales, #3)","male","American","","","","American",3,"Andrea",NA
"James Frey","male","A Million Little Pieces","male","American","","","","American",1,"Bernadette",NA
"James Gleick","male","Time Travel: A History","male","American","","","","American",1,"Adam",NA
"James Hannaham","male","Delicious Foods","male","","","","","",1,"Stephanie",NA
"James Herriot","male","All Creatures Great and Small","male","British","","","","British",3,"Andrea",NA
"James Hilton","male","Nothing So Strange","male","British","English","","","English",1,"Andrea",NA
"James Joyce","male","Dubliners","male","Irish","","","","Irish",7,"Andrea",NA
"James Kahn","male","Return of the Jedi (Star Wars: Novelizations, #6)","male","American","","","","American",1,"Viki",NA
"James Kelman","male","How Late It Was, How Late","male","British","Scottish","","","Scottish",1,"Luisa",NA
"James Luceno","male","Catalyst: A Rogue One Novel","male","American","","","","American",2,"Viki",NA
"James M. Cain","unknown","Double Indemnity","male","American","","","","American",1,"Maryann",NA
"James M. Fallows","male","China Airborne: The Test of China's Future","male","American","","","","American",1,"Glen",NA
"James M. McPherson","unknown","Battle Cry of Freedom","male","American","","","","American",1,"Maryann",NA
"James McNicholas","male","The Champ & The Chump: A heart-warming, hilarious true story about fighting and family","male","British","","","","British",NA,"Other",NA
"James Meek","male","Private Island: How the UK Was Sold","male","British","","","","British",1,"Viki",NA
"James Nestor","male","Breath: The New Science of a Lost Art","male","American","","","","American",3,"Mery",NA
"James P. Womack","male","The Machine That Changed the World: The Story of Lean Production-- Toyota's Secret Weapon in the Global Car Wars That Is Now Revolutionizing World Industry","male","American","","","","American",1,"Josh_Z",NA
"James Redfield","male","The Celestine Prophecy (Celestine Prophecy, #1)","male","American","","","","American",1,"Adam",NA
"James S.A. Corey","male","Leviathan Wakes (The Expanse, #1)","male","American","","","","American",6,"Andrea",NA
"James Salter","male","A Sport and a Pastime","male","American","","","","American",3,"Andrea",NA
"Jamie Ford","female","Love and Other Consolation Prizes","female","American","","","","American",3,"Bev",NA
"Jamie Metzl","female","Hacking Darwin: Genetic Engineering and the Future of Humanity","female","American","","","","American",1,"Ruby",NA
"Jamie O. Smith","female","Reading the Race: Tactics and Strategies for Bike Racing","female","American","","","","American",1,"Maggie",NA
"Jan Jarboe Russell","unknown","The Train to Crystal City: FDR's Secret Prisoner Exchange Program and America's Only Family Internment Camp During World War II","female","American","","","","American",1,"Maryann",NA
"Jan Stocklassa","male","The Man Who Played with Fire: Stieg Larsson's Lost Files and the Hunt for an Assassin","male","Swedish","","","","Swedish",1,"Sarah_McNabb",NA
"Jan-Philipp Sendker","unknown","The Art Of Hearing Heartbeats","male","German","","","","German",2,"Marian",NA
"Jancee Dunn","female","Why Is My Mother Getting a Tattoo?: And Other Questions I Wish I Never Had to Ask","female","American","","","","American",1,"Andrea",NA
"Jandy Nelson","unknown","The Sky Is Everywhere","female","American","","","","American",2,"Stephanie",NA
"Jane Austen","female","Sense and Sensibility","female","British","","","","British",26,"Andrea",NA
"Jane Carruth","female","Alice in Wonderland","female","American","","","","American",2,"Maggie",NA
"Jane Elson","female","A Room Full of Chocolate","female","British","","","","British",1,"Viki",NA
"Jane Fallon","female","Getting Rid Of Matthew","female","British","English","","","English",1,"Viki",NA
