"Author","gender_guessed","Title","gender_fixed","nationality1","nationality2","nationality3","nationality4","Country.Chosen","n","Source","country_chosen"
"Timothy Ferris","male","Coming of Age in the Milky Way","male","American","","","","American",1,"Tiff",NA
"Timothy Ferriss","male","Tribe of Mentors: Short Life Advice from the Best in the World","male","American","","","","American",4,"Ruby",NA
"Timothy J. Keller","male","Counterfeit Gods: The Empty Promises of Money, Sex, and Power, and the Only Hope That Matters","male","American","","","","American",1,"Charlotte",NA
"Timothy Snyder","male","On Tyranny: Twenty Lessons from the Twentieth Century","male","American","","","","American",1,"Adam",NA
"Timothy Zahn","male","Thrawn: Alliances (Star Wars: Thrawn, #2)","male","American","","","","American",5,"Viki",NA
"Tina Basich","female","Pretty Good for a Girl: The Autobiography of a Snowboarding Pioneer","female","American","","","","American",1,"Andrea",NA
"Tina Connolly","female","The Last Banquet of Temporal Confections","female","American","","","","American",1,"Viki",NA
"Tina Fey","female","Bossypants","female","American","","","","American",5,"Andrea",NA
"Tite Kubo","unknown","Bleach, Volume 13","male","Japanese","","","","Japanese",4,"Elena",NA
"Tobias S. Buckell","male","Diverse Energies","male","American","Grenadian","","","Grenadian",1,"Tiff",NA
"Tobias Wolff","male","This Boy's Life","male","American","","","","American",1,"Eva",NA
"Tochi Onyebuchi","unknown","Riot Baby","male","American","","","","American",2,"Ruby",NA
"Todd Balf","male","Major: A Black Athlete, a White Era, and the Fight to Be the World's Fastest Human Being","male","American","","","","American",5,"Luisa",NA
"Tom Brokaw","unknown","The Greatest Generation","male","American","","","","American",1,"Josh_Z",NA
"Tom Holt","male","The Management Style of the Supreme Beings","male","British","","","","British",4,"Viki",NA
"Tom Lloyd","male","Stranger of Tempest (The God Fragments, #1)","male","British","","","","British",1,"Viki",NA
"Tom MacDonald","male","The Charlestown Connection","male","Canadian","","","","Canadian",1,"Marian",NA
"Tom Perrotta","unknown","Mrs. Fletcher","male","American","","","","American",2,"Adam",NA
"Tom Pollock","male","White Rabbit, Red Wolf","male","American","","","","American",1,"Viki",NA
"Tom Rachman","unknown","The Imperfectionists","male","British","Canadian","English","","Canadian",1,"Maryann",NA
"Tom Robbins","male","Skinny Legs and All","male","American","","","","American",7,"Andrea",NA
"Tom Standage","male","Writing on the Wall: Social Media - The First 2,000 Years","male","English","","","","English",1,"Stephanie",NA
"Tom Stoppard","male","Rosencrantz and Guildenstern Are Dead","male","Czechoslovak","English","","","Czechoslovak",4,"Adam",NA
"Tom Vanderbilt","male","Beginners: The Joy and Transformative Power of Lifelong Learning","male","American","","","","American",1,"Maggie",NA
"Tom Wolfe","unknown","The Bonfire of the Vanities","male","American","","","","American",2,"Maryann",NA
"Tomi Adeyemi","male","Children of Virtue and Vengeance (Legacy of Orïsha, #2)","male","American","","","","American",3,"Viki",NA
"Tommy Caldwell","male","The Push: A Climber's Journey of Endurance, Risk, and Going Beyond Limits","male","American","","","","American",1,"Luisa",NA
"Tommy Orange","male","There There","male","American","","","","American",7,"Andrea",NA
"Toni Morrison","male","Beloved","female","American","","","","American",21,"Cal",NA
"Tony D'Souza","male","Whiteman","male","American","","","","American",1,"Cal",NA
"Tony Horwitz","male","Confederates in the Attic: Dispatches from the Unfinished Civil War","male","American","","","","American",1,"Sarah_McNabb",NA
"Tony Kushner","male","Angels in America","male","American","","","","American",1,"Sarah_McNabb",NA
"Tony Parsons","male","One for My Baby","male","British","","English","","British",3,"Viki",NA
"Tony Strong","male","Believe Me","male","British","","","","British",1,"Viki",NA
"Tonya Plank","female","Swallow","female","American","","","","American",1,"Andrea",NA
"Torrey Peters","male","Detransition, Baby","male","American","","","","American",1,"Luisa",NA
"Toshikazu Kawaguchi","male","Before the Coffee Gets Cold (Before the Coffee Gets Cold, #1)","male","Japanese","","","","Japanese",2,"Viki",NA
"Tove Ditlevsen","female","The Faces","female","Danish","","","","Danish",1,"Luisa",NA
"Tracey Garvis Graves","unknown","On the Island (On the Island, #1)","female","American","","","","American",1,"Stephanie",NA
"Tracy Chevalier","female","Girl with a Pearl Earring","female","American","","","","American",5,"Andrea",NA
"Tracy K. Smith","female","Ordinary Light","female","American","","","","American",1,"Andrea",NA
"Tracy Kidder","female","Mountains Beyond Mountains: The Quest of Dr. Paul Farmer, a Man Who Would Cure the World","female","American","","","","American",6,"Ruby",NA
"Tracy Townsend","female","The Nine (Thieves of Fate, #1)","female","American","","","","American",1,"Adam",NA
"Trevor Noah","male","Born a Crime: Stories From a South African Childhood","male","South African","","","","South African",9,"Cal",NA
"Tricia Sullivan","female","Sweet Dreams","female","American","British","","","British",1,"Viki",NA
"Trinh T. Minh-ha","female","Woman, Native, Other: Writing Postcoloniality and Feminism","female","American","Vietnamese","","","Vietnamese",1,"Sarah_McNabb",NA
"Trista Mateer","female","The Dogs I Have Kissed","female","American","","","","American",1,"Viki",NA
"Trudi Canavan","female","Maker's Curse (Millennium's Rule #4)","female","Australian","","","","Australian",6,"Viki",NA
"Truman Capote","male","Breakfast at Tiffany's and Three Stories","male","American","","","","American",5,"Sarah_McNabb",NA
"Tsitsi Dangarembga","unknown","Nervous Conditions","female","Zimbabwean","","","","Zimbabwean",2,"Viki",NA
"Tsugumi Ohba","unknown","Bakuman, Volume 4: Phone Call and the Night Before (Bakuman, #4)","male","Japanese","","","","Japanese",5,"Elena",NA
"Tung Nguyen","female","Mango and Peppercorns: A Memoir of Food, an Unlikely Family","female","Vietnamese","American","","","Vietnamese",NA,"Other",NA
"Tupelo Hassman","unknown","Girlchild","female","American","","","","American",1,"Andrea",NA
"Tyler Cowen","male","Stubborn Attachments: A Vision for a Society of Free, Prosperous, and Responsible Individuals","male","American","","","","American",NA,"Other",NA
"Tyler Whitesides","male","The Thousand Deaths of Ardor Benn","male","American","","","","American",1,"Viki",NA
"Ulrich Alexander Boschwitz","male","The Passenger","male","German","","","","German",1,"Luisa",NA
"Ulysses S. Grant","male","The Autobiography of General Ulysses S Grant: Memoirs of the Civil War","male","American","","","","American",1,"Luisa",NA
"Umberto Eco","male","Six Walks in the Fictional Woods (Revised)","male","Italian","","","","Italian",5,"Adam",NA
"Umberto Pelizzari","male","Manual Of Freediving: Underwater On A Single Breath","male","Italian","","","","Italian",1,"Maggie",NA
"Un-su Kim","unknown","The Plotters","female","South Korean","","","","South Korean",1,"Maryann",NA
"Una Mannion","female","A Crooked Tree","female","American","Irish","","","Irish",1,"Viki",NA
"Unknown","unknown","Beowulf","unknown","Unknown","","","","Unknown",8,"Andrea",NA
"Upton Sinclair","unknown","The Jungle","male","American","","","","American",2,"Ruby",NA
"Ursula DeYoung","female","Shorecliff","female","American","","","","American",1,"Bev",NA
"Ursula Hegi","unknown","Stones from the River (Burgdorf Cycle, #1)","female","American","","","","American",1,"Maryann",NA
"Ursula K. Le Guin","female","The Lathe of Heaven","female","American","","","","American",12,"Adam",NA
"V.E. Schwab","unknown","Vicious (Villains, #1)","female","American","","","","American",2,"Andrea",NA
"V.S. Naipaul","unknown","A House for Mr Biswas","male","British","Trinidadian","","","Trinidadian",3,"Maryann",NA
"Vaclav Smil","unknown","Energy and Civilization: A History","male","Canadian","Czech","","","Czech",1,"Josh_Z",NA
"Vaddey Ratner","unknown","In the Shadow of the Banyan","female","Cambodian","","","","Cambodian",2,"Maryann",NA
"Val Emmich","female","Dear Evan Hansen","female","American","","","","American",1,"Liz",NA
"Val McDermid","female","Forensics: What Bugs, Burns, Prints, DNA and More Tell Us About Crime","female","British","Scottish","","","Scottish",4,"Sarah_McNabb",NA
"Valarie Kaur","female","See No Stranger: A Memoir and Manifesto of Revolutionary Love","female","American","","","","American",1,"Luisa",NA
"Valeria Luiselli","female","Lost Children Archive","female","Mexican","","","","Mexican",2,"Viki",NA
"Valerie Gilpeer","female","I Have Been Buried Under Years of Dust: A Memoir of Autism and Hope","female","American","","","","American",1,"Luisa",NA
"Valerio Massimo Manfredi","unknown","Lo scudo di Talos","male","Italian","","","","Italian",2,"Elena",NA
"Van Jones","male","Beyond the Messy Truth: How We Came Apart, How We Come Together","male","American","","","","American",1,"Luisa",NA
"Vanessa Diffenbaugh","female","The Language of Flowers","female","American","","","","American",2,"Bev",NA
"Vanessa Springora","female","Le Consentement","female","French","","","","French",NA,"Other",NA
"Veera Hiranandani","female","The Night Diary","female","American","","","","American",2,"Bev",NA
"Vera Brosgol","female","Anya's Ghost","female","American","","","","American",1,"Charlotte",NA
"Vernor Vinge","unknown","A Deepness in the Sky (Zones of Thought, #2)","male","American","","","","American",1,"Andrea",NA
"Veronica Roth","female","Insurgent (Divergent, #2)","female","American","","","","American",7,"Bernadette",NA
"Vicki Iovine","female","The Girlfriends' Guide to Pregnancy","female","American","","","","American",1,"Stephanie",NA
"Vicky Spring","female","Bicycling the Pacific Coast: a complete route guide, Canada to Mexico","female","","","","","",1,"Maggie",NA
"Victor Hugo","male","The Hunchback of Notre-Dame","male","French","","","","French",12,"Adam",NA
"Victor LaValle","male","The Ballad of Black Tom","male","American","","","","American",1,"Viki",NA
"Victoria James","female","Wine Girl: The Obstacles, Humiliations, and Triumphs of America's Youngest Sommelier","female","American","","","","American",1,"Liz",NA
"Victoria Sweet","female","God's Hotel: A Doctor, a Hospital, and a Pilgrimage to the Heart of Medicine","female","American","","","","American",1,"Maryann",NA
"Viet Thanh Nguyen","unknown","The Refugees","male","American","","","","American",9,"Ruby",NA
"Vijay Prashad","male","Washington Bullets","male","American","Indian","","","Indian",1,"Elena",NA
"Vikas Swarup","male","Slumdog Millionaire","male","Indian","","","","Indian",1,"Viki",NA
"Vikram Seth","male","A Suitable Boy (A Bridge of Leaves, #1)","male","Indian","","","","Indian",7,"Andrea",NA
"Viktor E. Frankl","male","Man's Search for Meaning","male","Austrian","","","","Austrian",2,"Alison_Shin",NA
"Viktor Mayer-Schönberger","male","Big Data: A Revolution That Will Transform How We Live, Work, and Think","male","Austrian","","","","Austrian",1,"Sarah_McNabb",NA
"Vince Vawter","male","Paperboy","male","American","","","","American",1,"Stephanie",NA
"Vincent Bevins","male","The Jakarta Method: Washington's Anticommunist Crusade and the Mass Murder Program that Shaped Our World","male","American","","","","American",1,"Cal",NA
"Vincent Bugliosi","unknown","Helter Skelter: The True Story of the Manson Murders","male","American","","","","American",1,"Maryann",NA
"Violet Kupersmith","female","Build Your House Around My Body","female","American","Vietnamese","","","Vietnamese",1,"Viki",NA
"Virginia Eubanks","female","Automating Inequality: How High-Tech Tools Profile, Police, and Punish the Poor","female","American","","","","American",NA,"Other",NA
"Virginia Hamilton","female","Ring Of Tricksters: Tales From America, the West Indies, and Africa","female","American","","","","American",1,"Adam",NA
"Virginia Lee Burton","female","Mike Mulligan and His Steam Shovel","female","American","","","","American",1,"Adam",NA
"Virginia Woolf","female","A Room of One's Own","female","British","English","","","English",10,"Andrea",NA
"Vivian Gornick","female","The Odd Woman and the City: A Memoir","female","American","","","","American",NA,"Other",NA
"Vladimir Nabokov","male","Pnin","male","American","Russian","Swiss","","Swiss",10,"Cal",NA
"Voltaire","male","Candide","male","French","","","","French",3,"Andrea",NA
"Vron Ware","unknown","Beyond the Pale: White Women, Racism, and History","female","British","","","","British",1,"Viki",NA
"Vu Hong Lien","male","Descending Dragon, Rising Tiger: A History of Vietnam","male","Vietnamese","English","","","Vietnamese",1,"Cal",NA
"W. Chan Kim","unknown","Blue Ocean Strategy: How to Create Uncontested Market Space and Make the Competition Irrelevant","female","South Korean","","","","South Korean",1,"Glen",NA
"W. Haden Blackman","unknown","Elektra, Volume 1: Bloodlines","male","American","","","","American",1,"Viki",NA
"W. Somerset Maugham","unknown","The Painted Veil","male","British","French","","","French",4,"Andrea",NA
"W.E.B. Du Bois","unknown","Darkwater: Voices from Within the Veil","male","American","Ghanaian","","","Ghanaian",1,"Viki",NA
"W.G. Sebald","unknown","Austerlitz","male","German","","","","German",1,"Maryann",NA
"W.R. Bolen","unknown","Total Frat Move","male","American","","","","American",1,"Josh_Z",NA
"Wade Shepard","male","Ghost Cities of China: The Story of Cities without People in the World's Most Populated Country","male","American","","","","American",1,"Viki",NA
"Walker Percy","male","The Moviegoer","male","American","","","","American",1,"Eva",NA
"Wallace Stegner","male","Angle of Repose","male","American","","","","American",1,"Eva",NA
"Wally Lamb","male","We Are Water","male","American","","","","American",3,"Bev",NA
"Walt Disney Company","male","Be Our Guest: Perfecting the Art of Customer Service","male","American","","","","American",1,"Charlotte",NA
"Walt Whitman","male","Leaves of Grass","male","American","","","","American",1,"Eva",NA
"Walter Abish","male","How German Is It (Wie Deutsch ist es)","male","American","Austrian","","","Austrian",1,"Eva",NA
"Walter Farley","male","The Black Stallion Returns (Black Stallion Series, Book 2)","male","American","","","","American",7,"Andrea",NA
"Walter Isaacson","male","Leonardo da Vinci","male","American","","","","American",5,"Adam",NA
"Walter Laqueur","male","The Road to War: The Origin and Aftermath of the Arab-Israel Conflict 1967-8","male","American","British","German","Israeli","Israeli",1,"Andrea",NA
"Walter Mosley","male","White Butterfly (Easy Rawlins #3)","male","American","","","","American",5,"Andrea",NA
"Walter Murch","male","In the Blink of an Eye: A Perspective on Film Editing","male","American","","","","American",1,"Adam",NA
"Walter Tevis","male","The Queen's Gambit","male","American","","","","American",1,"Luisa",NA
"Wanda Coleman","female","Mercurochrome","female","American","","","","American",NA,"Other",NA
"Wang Fan-hsi","unknown","Memoirs Of A Chinese Revolutionary","male","Chinese","","","","Chinese",1,"Viki",NA
"Wangari Maathai","unknown","Unbowed","female","Kenyan","","","","Kenyan",1,"Alison_Shin",NA
"Washington Irving","unknown","The Sketch Book","male","American","","","","American",3,"Andrea",NA
"Wassily Kandinsky","male","Concerning the Spiritual in Art","male","French","Russian","","","Russian",1,"Adam",NA
"Weike Wang","unknown","Chemistry","female","Chinese","American","","","Chinese",1,"Tiff",NA
"Wendy Moore","female","No Man's Land: The Trailblazing Women Who Ran Britain’s Most Extraordinary Military Hospital During World War I","female","British","","","","British",1,"Maryann",NA
"Wenguang Huang","unknown","The Little Red Guard","male","Chinese","American","","","Chinese",1,"Andrea",NA
"Wes  Moore","male","The Other Wes Moore: One Name, Two Fates","male","American","","","","American",NA,"Other",NA
"Wes """"""""""""""""""""""""""""""""""""""""""""""""""""""""""""""""""""""""""""""""""""""""""""""""""""""""""""""""""""""""""""""""""""""""""""""""""""""""""""""""""""""""""""""""""""""""""""""""""""""""""""""""""""""""""""""""""""""""""""""""""""""""""""""""Scoop"""""""""""""""""""""""""""""""""""""""""""""""""""""""""""""""""""""""""""""""""""""""""""""""""""""""""""""""""""""""""""""""""""""""""""""""""""""""""""""""""""""""""""""""""""""""""""""""""""""""""""""""""""""""""""""""""""""""""""""""""""""""""""""""" Nisker","male","Crazy Wisdom","male","American","","","","American",NA,"Other",NA
"Wesley Chu","male","The Rise of Io","male","Taiwanese","","","","Taiwanese",1,"Viki",NA
"Wesley Lowery","male","They Can't Kill Us All: The Story of Black Lives Matter","male","American","","","","American",1,"Viki",NA
"Wiley Cash","male","A Land More Kind Than Home","male","American","","","","American",1,"Stephanie",NA
"Will  Harris","male","Rendang","male","American","","","","American",1,"Viki",NA
"Will Corona Pilgrim","male","Marvel's The Avengers - Age of Ultron Prelude","male","American","","","","American",1,"Viki",NA
"Will Dean","male","Black River (Tuva Moodyson Mystery, #3)","male","Canadian","","","","Canadian",1,"Viki",NA
"Will Durant","male","Fallen Leaves: Last Words on Life, Love, War, and God","male","American","","","","American",NA,"Other",NA
"Will Ferguson","male","419","male","Canadian","","","","Canadian",2,"Corinne",NA
"Will Schwalbe","male","The End of Your Life Book Club","male","American","","","","American",2,"Bev",NA
"Willa Cather","female","My Ántonia (Great Plains Trilogy, #3)","female","American","","","","American",3,"Cal",NA
"William  Boyd","unknown","Any Human Heart","male","British","","","","British",1,"Josh_Z",NA
"William  Kennedy","male","Ironweed","male","American","","","","American",1,"Andrea",NA
"William B. Helmreich","male","The New York Nobody Knows: Walking 6,000 Miles in the City","male","American","","","","American",1,"Sarah_McNabb",NA
"William Blake","male","Songs of Innocence and of Experience","male","British","English","","","English",1,"Eva",NA
"William C. Taylor","male","Practically Radical: Not-So-Crazy Ways to Transform Your Company, Shake Up Your Industry, and Challenge Yourself","male","American","","","","American",NA,"Other",NA
"William D. Cohan","male","Money and Power: How Goldman Sachs Came to Rule the World","male","American","","","","American",1,"Andrea",NA
"William Deresiewicz","male","A Jane Austen Education: How Six Novels Taught Me About Love, Friendship, and the Things That Really Matter","male","American","","","","American",NA,"Other",NA
"William F. Nolan","male","Logan's Run","male","American","","","","American",1,"Viki",NA
"William Faulkner","male","The Sound and the Fury","male","American","","","","American",4,"Andrea",NA
"William Finnegan","male","Barbarian Days: A Surfing Life","male","American","","","","American",1,"Maggie",NA
"William Gibson","male","The Difference Engine","male","American","Canadian","","","Canadian",6,"Andrea",NA
"William Golding","male","Lord of the Flies","male","British","","","","British",12,"Cal",NA
"William Goldman","male","The Princess Bride","male","American","","","","American",5,"Andrea",NA
"William Hope Hodgson","male","The House on the Borderland","male","British","","","","British",1,"Adam",NA
"William Inge","male","Bus Stop","male","American","","","","American",1,"Andrea",NA
"William J. Bernstein","male","A Splendid Exchange: How Trade Shaped the World from Prehistory to Today","male","American","","","","American",1,"Cal",NA
"William Kamkwamba","unknown","The Boy Who Harnessed the Wind: Creating Currents of Electricity and Hope","male","Malawian","","","","Malawian",1,"Josh_Z",NA
"William Kent Krueger","male","This Tender Land","male","American","","","","American",2,"Bev",NA
"William L. Shirer","unknown","The Rise and Fall of the Third Reich: A History of Nazi Germany","male","American","","","","American",1,"Maryann",NA
"William Landay","male","Defending Jacob","male","American","","","","American",2,"Liz",NA
"William Makepeace Thackeray","unknown","The Paris Sketch Book Of Mr. M. A. Titmarsh","male","British","English","","","English",1,"Andrea",NA
"William Manchester","unknown","A World Lit Only by Fire: The Medieval Mind and the Renaissance: Portrait of an Age","male","American","","","","American",1,"Maryann",NA
"William Melvin Kelley","male","A Different Drummer","male","American","","","","American",1,"Viki",NA
"William Paul Young","male","The Shack","male","American","Canadian","","","Canadian",1,"Mery",NA
"William S. Burroughs","unknown","Naked Lunch","male","American","","","","American",1,"Josh_Z",NA
"William S. White","male","Expanding Minds and Opportunities: Leveraging the Power of Afterschool and Summer Learning for Student Success","male","American","","","","American",1,"Stephanie",NA
"William Shakespeare","male","Hamlet","male","English","","","","English",38,"Cal",NA
"William Strunk Jr.","male","The Elements of Style","male","American","","","","American",2,"Adam",NA
"William Styron","male","Darkness Visible: A Memoir of Madness","male","American","","","","American",5,"Ruby",NA
"William Ury","male","The Power of a Positive No: How to Say No and Still Get to Yes","male","American","","","","American",NA,"Other",NA
"Wilson Rawls","male","Where the Red Fern Grows","male","American","","","","American",3,"Andrea",NA
"Winsor McCay","unknown","Little Nemo: 1905-1914","male","American","Canadian","","","Canadian",1,"Adam",NA
"Winston Ma","male","China's Mobile Economy: Opportunities in the Largest and Fastest Information Consumption Boom","male","Chinese","","","","Chinese",NA,"Other",NA
"Wu Ming-Yi","unknown","The Stolen Bicycle","male","Taiwanese","","","","Taiwanese",1,"Viki",NA
"Xiaobo Liu","unknown","June Fourth Elegies","male","Chinese","","","","Chinese",2,"Viki",NA
"Xiaolu Guo","unknown","Once Upon a Time in the East: A Story of Growing Up","female","British","Chinese","","","Chinese",4,"Sarah_McNabb",NA
"Xinran","unknown","Message from an Unknown Chinese Mother: Stories of Loss and Love","female","British","","","","British",1,"Viki",NA
"Yaa Gyasi","unknown","Homegoing","female","American","Ghanaian","","","Ghanaian",10,"Andrea",NA
"Yamamoto Tsunetomo","unknown","Hagakure: The Book of the Samurai","male","Japanese","","","","Japanese",1,"Maryann",NA
"Yangsze Choo","unknown","The Night Tiger","female","Malaysian","","","","Malaysian",1,"Maryann",NA
"Yann Martel","male","Life of Pi","male","Canadian","Spanish","","","Spanish",9,"Andrea",NA
"Yara Rodrigues Fowler","female","Stubborn Archivist","female","Brazilian","British","","","Brazilian",1,"Viki",NA
"Yaşar Kemal","male","Memed, My Hawk (İnce Memed, #1)","male","Turkish","","","","Turkish",1,"Cal",NA
"Yasuhisa Hara","male","キングダム 6 [Kingdom 6]","male","Japanese","","","","Japanese",1,"Elena",NA
"Yevgeny Zamyatin","male","We","male","Russian","Soviet","","","Russian",1,"Adam",NA
"Yiannis Papadakis","male","Echoes from the Dead Zone: Across the Cyprus Divide","male","Cypriot","","","","Cypriot",NA,"Other",NA
"Yiyun Li","unknown","A Thousand Years of Good Prayers","female","American","Chinese","","","Chinese",2,"Maryann",NA
"Yōko Ogawa","unknown","The Memory Police","female","Japanese","","","","Japanese",2,"Maryann",NA
"Yoon Ha Lee","unknown","Ninefox Gambit (The Machineries of Empire, #1)","male","American","","","","American",1,"Viki",NA
"Yoshitoki Ōima","unknown","è²ã®å½¢ 2 [Koe no Katachi 2] (A Silent Voice, #2)","female","Japanese","","","","Japanese",2,"Elena",NA
"Yoshiyuki Sadamoto","male","Neon Genesis Evangelion, Vol. 1","male","Japanese","","","","Japanese",1,"Elena",NA
"You-Jeong Jeong","unknown","The Good Son","female","South Korean","","","","South Korean",2,"Viki",NA
"Young-Ha Kim","unknown","Diary of a Murderer: And Other Stories","male","South Korean","","","","South Korean",1,"Viki",NA
"Yrsa Daley-Ward","female","The Terrible: A Storyteller's Memoir","female","British","","","","British",2,"Bernadette",NA
"Yu Hua","andy","To Live","male","Chinese","","","","Chinese",NA,"Other",NA
"Yukiko Motoya","female","The Lonesome Bodybuilder","female","Japanese","","","","Japanese",1,"Viki",NA
"Yukio Mishima","male","The Sound of Waves","male","Japanese","","","","Japanese",1,"Eva",NA
"Yukito Ayatsuji","unknown","The Decagon House Murders","male","Japanese","","","","Japanese",1,"Viki",NA
"Yūko Tsushima","unknown","The Shooting Gallery","female","Japanese","","","","Japanese",1,"Sarah_McNabb",NA
"Yun Ko-eun","unknown","The Disaster Tourist","female","South Korean","","","","South Korean",1,"Viki",NA
"Yūsei Matsui","unknown","ææ®ºæå®¤ 1 [Ansatsu Kyoushitsu 1] (Assassination Classroom, #1)","male","Japanese","","","","Japanese",1,"Elena",NA
"Yuval Noah Harari","male","Sapiens: A Brief History of Humankind","male","Israeli","","","","Israeli",7,"Ruby",NA
"Yvon Chouinard","male","Let My People Go Surfing: The Education of a Reluctant Businessman--Including 10 More Years of Business Unusual","male","American","","","","American",2,"Charlotte",NA
"Yvonne Fern","female","Gene Roddenberry: The Last Conversation (Portraits of American Genius #2)","female","American","","","","American",1,"Adam",NA
"Zachary Kanin","male","Short Book: Tall Stories, Freakish Facts, and the Long and Short of Being Small in a Great Big World.","male","American","","","","American",1,"Cal",NA
"Zachary Mexico","male","China Underground","male","American","","","","American",1,"Andrea",NA
"Zadie Smith","unknown","On Beauty","female","British","","","","British",10,"Andrea",NA
"Zakiya Dalila Harris","unknown","The Other Black Girl","female","American","","","","American",2,"Viki",NA
"Zane Grey","female","Wanderer of the Wasteland","female","American","","","","American",NA,"Other",NA
"Zen Cho","unknown","The Perilous Life of Jade Yeo","male","Malaysian","","","","Malaysian",4,"Viki",NA
